{
  "bootstrap_server": "localhost:9092",
  "num_workers": 1,
  "topic_name": "topic-mnrdata",
  "group_id": "sample_group",
  "auto_offset_reset": "latest",
  "num_threads": 1,
  "sink": {
    "topic": "output-events",
    "properties": {
      "bootstrap_servers": "edge-kafka-bootstrap:9093"
    }
  },
  "advance_inputs": {
    "security_protocol": "SASL_PLAINTEXT",
    "sasl_mechanism": "PLAIN",
    "username" : "admin",
    "password" : "12345"
  }
}